{
  "schemaVersion": "drobon.vuln-intel/v1",
  "fixture": false,
  "id": "GHSA-3hj7-6vmj-h8v4",
  "ecosystem": "pypi",
  "package": "pacioli-guard",
  "summary": "pacioli: A submit consent marker licensed cancellation of caller-named pre-existing documents",
  "severity": "MEDIUM",
  "url": "https://github.com/advisories/GHSA-3hj7-6vmj-h8v4",
  "affected": [
    {
      "range": ">= 0.9.6, < 0.10.0",
      "fixed": "0.10.0"
    }
  ],
  "provenance": {
    "source": "GHSA",
    "sourceUrl": "https://github.com/advisories/GHSA-3hj7-6vmj-h8v4",
    "retrievedAt": "2026-10-14T14:07:21.280Z",
    "license": "Verify terms: github.com/github/advisory-database"
  }
}
